{
  "meta": {
    "schema_version": "1.0",
    "library_version": "0.1.0",
    "updated": "2026-07-15",
    "owner": "AfCEN",
    "status": "starter",
    "notes": "Starter library. Every entry carries a resolvable locator per FR-14 and a range with a sample count per FR-16. Entries with n<3 cannot raise a Material flag per FR-18. Escalation is a placeholder until a named index is set: see escalation.indices. Do not set Material thresholds on this library until meta.status reaches 'production'."
  },
  "sources": {
    "esmap2026": {
      "publisher": "ESMAP / World Bank",
      "title": "Understanding the Cost of Transmission Infrastructure: Insights from World Bank Group-Financed Transmission Projects",
      "year": 2026,
      "url": "https://www.esmap.org/publications/understanding-cost-transmission-infrastructure-insights-world-bank-group-financed",
      "tier": 1,
      "primary": true,
      "licence": "CC BY 3.0 IGO",
      "licence_confirmed": false,
      "coverage": "74 World Bank Group transmission projects, 2000-2024, USD 21bn, mined from 469 screened projects. Plus a literature review of six prior studies.",
      "locator_required": true
    },
    "miso_mtep": {
      "publisher": "Midcontinent Independent System Operator",
      "title": "Transmission Cost Estimation Guide (MTEP series)",
      "year": 2024,
      "url": "",
      "tier": 1,
      "primary": false,
      "licence": "unknown",
      "licence_confirmed": false,
      "coverage": "US component unit costs by voltage: line, substation, bay, shunt reactor. Updated annually.",
      "locator_required": true
    },
    "bulambuli_pfs_2020": {
      "publisher": "responsAbility Renewable Energy Holding",
      "title": "Pre-Feasibility Study for the Proposed 132 kV Bulambuli-Moroto-Kitgum Transmission Project (Phase One)",
      "year": 2020,
      "url": "",
      "tier": 3,
      "primary": true,
      "licence": "Developer project data. TOR Section 14.",
      "licence_confirmed": true,
      "coverage": "Single project, Uganda. Pre-feasibility level.",
      "locator_required": true
    },
    "ghanzi_gobabis_pfs_2026": {
      "publisher": "AfCEN",
      "title": "Botswana-Namibia 400 kV Ghanzi-Gobabis Interconnector Pre-Feasibility Study",
      "year": 2026,
      "url": "",
      "tier": 3,
      "primary": true,
      "licence": "Own work.",
      "licence_confirmed": true,
      "coverage": "Single project, Botswana-Namibia. Pre-feasibility level.",
      "locator_required": true
    },
    "aace_18r97": {
      "publisher": "AACE International",
      "title": "Recommended Practice 18R-97, Cost Estimate Classification System. See also 98R-18 for transport infrastructure.",
      "year": 1997,
      "url": "https://web.aacei.org/docs/default-source/toc/toc_18r-97.pdf",
      "tier": 1,
      "primary": false,
      "licence": "AACE single user licence. Reference only.",
      "licence_confirmed": false,
      "coverage": "Estimate classification and accuracy ranges.",
      "locator_required": true
    }
  },
  "escalation": {
    "indices": {
      "PLACEHOLDER_GENERIC": {
        "name": "Placeholder generic escalation",
        "status": "placeholder",
        "source": "Not set. FR-15 requires a named index. Any result computed with this index is provisional and must be labelled as such.",
        "factors": {
          "2003": 82.0,
          "2010": 100.0,
          "2014": 106.0,
          "2018": 116.0,
          "2020": 127.0,
          "2022": 148.0,
          "2024": 158.0,
          "2026": 165.0
        }
      }
    }
  },
  "market_adjustments": [
    {
      "id": "MKT-DEVD-TO-DEVG",
      "from_market": "developed",
      "to_market": "developing",
      "divisor_low": 1.56,
      "divisor_high": 4.35,
      "source_id": "esmap2026",
      "locator": "Key Findings and Introduction. World Bank Group financed projects run 1.56 to 4.35 times below analysed developed-market benchmarks.",
      "notes": "Wide by design. Applying it produces a band, not a point. Within the sample, Eastern and Southern Africa sits at the higher-cost end and Western and Central Africa at the lower end, so a project in East Africa should be read toward the upper part of the resulting band."
    }
  ],
  "benchmarks": [
    {
      "id": "TL-UC-110-150-SC-LIT",
      "metric": "line_capex_per_km",
      "asset": {
        "voltage_kv_min": 110,
        "voltage_kv_max": 150,
        "circuits": "single",
        "technology": "HVAC"
      },
      "value": {
        "low": 0.304,
        "high": 0.304,
        "unit": "USD_M_per_km",
        "n": 1,
        "central": 0.304
      },
      "basis": {
        "price_year": 2010,
        "currency": "USD",
        "scope": "transmission line unit cost as published by the underlying study. Component scope not standardised across studies.",
        "market": "developed",
        "kind": "estimate"
      },
      "geography": {
        "region": "US and Europe",
        "countries": []
      },
      "source_id": "esmap2026",
      "locator": "Table 2.1, Compiled Transmission Line Unit Cost from Studies",
      "confidence": "low",
      "notes": "n=1. Advisory only per FR-18.",
      "added": "2026-07-15",
      "review_by": "2027-07-15",
      "superseded_by": null
    },
    {
      "id": "TL-UC-110-150-DC-LIT",
      "metric": "line_capex_per_km",
      "asset": {
        "voltage_kv_min": 110,
        "voltage_kv_max": 150,
        "circuits": "double",
        "technology": "HVAC"
      },
      "value": {
        "low": 0.318,
        "high": 0.421,
        "unit": "USD_M_per_km",
        "n": 2,
        "central": null
      },
      "basis": {
        "price_year": 2010,
        "currency": "USD",
        "scope": "transmission line unit cost as published by the underlying studies. Component scope not standardised.",
        "market": "developed",
        "kind": "estimate"
      },
      "geography": {
        "region": "US and Europe",
        "countries": []
      },
      "source_id": "esmap2026",
      "locator": "Table 2.1, Compiled Transmission Line Unit Cost from Studies",
      "confidence": "low",
      "notes": "The band relevant to the 132 kV Bulambuli case. n=2, so Advisory only per FR-18 until more sources are added.",
      "added": "2026-07-15",
      "review_by": "2027-07-15",
      "superseded_by": null
    },
    {
      "id": "TL-UC-220-230-SC-LIT",
      "metric": "line_capex_per_km",
      "asset": {
        "voltage_kv_min": 220,
        "voltage_kv_max": 230,
        "circuits": "single",
        "technology": "HVAC"
      },
      "value": {
        "low": 0.403,
        "high": 0.854,
        "unit": "USD_M_per_km",
        "n": 3,
        "central": null
      },
      "basis": {
        "price_year": 2010,
        "currency": "USD",
        "scope": "as published, not standardised",
        "market": "developed",
        "kind": "estimate"
      },
      "geography": {
        "region": "US and Europe",
        "countries": []
      },
      "source_id": "esmap2026",
      "locator": "Table 2.1",
      "confidence": "medium",
      "notes": "min-to-max ratio 2.12.",
      "added": "2026-07-15",
      "review_by": "2027-07-15",
      "superseded_by": null
    },
    {
      "id": "TL-UC-220-230-DC-LIT",
      "metric": "line_capex_per_km",
      "asset": {
        "voltage_kv_min": 220,
        "voltage_kv_max": 230,
        "circuits": "double",
        "technology": "HVAC"
      },
      "value": {
        "low": 0.519,
        "high": 1.403,
        "unit": "USD_M_per_km",
        "n": 4,
        "central": null
      },
      "basis": {
        "price_year": 2010,
        "currency": "USD",
        "scope": "as published, not standardised",
        "market": "developed",
        "kind": "estimate"
      },
      "geography": {
        "region": "US and Europe",
        "countries": []
      },
      "source_id": "esmap2026",
      "locator": "Table 2.1",
      "confidence": "medium",
      "notes": "min-to-max ratio 2.70.",
      "added": "2026-07-15",
      "review_by": "2027-07-15",
      "superseded_by": null
    },
    {
      "id": "TL-UC-330-345-SC-LIT",
      "metric": "line_capex_per_km",
      "asset": {
        "voltage_kv_min": 330,
        "voltage_kv_max": 345,
        "circuits": "single",
        "technology": "HVAC"
      },
      "value": {
        "low": 0.634,
        "high": 1.22,
        "unit": "USD_M_per_km",
        "n": 4,
        "central": null
      },
      "basis": {
        "price_year": 2010,
        "currency": "USD",
        "scope": "as published, not standardised",
        "market": "developed",
        "kind": "estimate"
      },
      "geography": {
        "region": "US and Europe",
        "countries": []
      },
      "source_id": "esmap2026",
      "locator": "Table 2.1",
      "confidence": "medium",
      "notes": "min-to-max ratio 1.92.",
      "added": "2026-07-15",
      "review_by": "2027-07-15",
      "superseded_by": null
    },
    {
      "id": "TL-UC-330-345-DC-LIT",
      "metric": "line_capex_per_km",
      "asset": {
        "voltage_kv_min": 330,
        "voltage_kv_max": 345,
        "circuits": "double",
        "technology": "HVAC"
      },
      "value": {
        "low": 0.561,
        "high": 1.952,
        "unit": "USD_M_per_km",
        "n": 5,
        "central": null
      },
      "basis": {
        "price_year": 2010,
        "currency": "USD",
        "scope": "as published, not standardised",
        "market": "developed",
        "kind": "estimate"
      },
      "geography": {
        "region": "US and Europe",
        "countries": []
      },
      "source_id": "esmap2026",
      "locator": "Table 2.1",
      "confidence": "low",
      "notes": "min-to-max ratio 3.48, above the 2 to 3 spread ESMAP reports for its own sample. Verify the component scope of the extremes against the source table before using this band.",
      "added": "2026-07-15",